{
  "schema_version": "0.1",
  "archive_version": "0.3",
  "archive_type": "month",
  "archive_month": "2011-07",
  "last_modified_at": "2026-06-06T10:31:15+09:00",
  "timezone": "Asia/Seoul",
  "item_count": 1,
  "event_count": 0,
  "source_counts": {
    "pnu-academic-math-undergrad-11218": 1
  },
  "items": [
    {
      "id": "pnu-academic-math-undergrad-11218:1074494",
      "url": "https://math.pusan.ac.kr/bbs/math/867/1074494/artclView.do",
      "title": "부산대학교 학점 이월제 안내",
      "content_text": "This feed does not mirror the full notice body. Fetch the original notice URL for complete content.",
      "summary": null,
      "date_published": "2011-07-29T00:00:00+09:00",
      "_pnu": {
        "source_id": "pnu-academic-math-undergrad-11218",
        "source_name": "부산대 수학과 학부공지",
        "published_at": "2011-07-29",
        "fetched_at": "2026-06-06T10:31:15+09:00",
        "snippet": null,
        "content_access": {
          "detail_url": "https://math.pusan.ac.kr/bbs/math/867/1074494/artclView.do",
          "requires_login": false,
          "content_mirrored": false,
          "attachments_mirrored": false
        },
        "attachments": [],
        "tags": [
          "pnu",
          "official",
          "academic_unit",
          "college_department",
          "department_notice",
          "undergrad"
        ],
        "content_hash": "2ab75d62b3cab123274e1bad9f1b5eec9a7e742af0acb6e02a44ef3ddfe2470a",
        "source_category": "academic_unit_undergraduate_notice",
        "source_tags": [
          "pnu",
          "official",
          "academic_unit",
          "college_department",
          "department_notice",
          "undergrad"
        ],
        "topics": [
          "undergraduate"
        ],
        "same_notice_group_id": null,
        "canonical_item_id": "pnu-academic-math-undergrad-11218:1074494",
        "is_canonical": true,
        "same_notice_source_ids": [
          "pnu-academic-math-undergrad-11218"
        ]
      },
      "_archive": {
        "archive_month": "2011-07",
        "first_seen_at": "2026-06-06T10:31:15+09:00",
        "last_seen_at": "2026-06-06T10:31:15+09:00",
        "last_changed_at": "2026-06-06T10:31:15+09:00",
        "current_content_hash": "2ab75d62b3cab123274e1bad9f1b5eec9a7e742af0acb6e02a44ef3ddfe2470a",
        "baseline_imported_at": "2026-06-06T10:31:15+09:00"
      }
    }
  ],
  "events": []
}
