{
  "schema_version": "0.1",
  "archive_version": "0.4",
  "archive_type": "month",
  "archive_month": "2011-06",
  "last_modified_at": "2026-06-06T13:51:13+09:00",
  "timezone": "Asia/Seoul",
  "item_count": 2,
  "event_count": 0,
  "source_counts": {
    "pnu-academic-ite-general-13812": 1,
    "pnu-academic-ite-career-13815": 1
  },
  "items": [
    {
      "id": "pnu-academic-ite-general-13812:1153895",
      "url": "https://ite.pusan.ac.kr/bbs/ite/1784/1153895/artclView.do",
      "title": "IT응용공학과 교육과정표(2025교육과정_업데이트)",
      "_pnu": {
        "source_id": "pnu-academic-ite-general-13812",
        "published_at": "2011-06-03",
        "fetched_at": "2026-06-06T10:31:15+09:00",
        "snippet": null,
        "attachments": [],
        "content_hash": "ce8653bf9cccb81845ac92b990ac6cd820f2db7707a492e990e5a68ce1685d15",
        "same_notice_group_id": "same_notice:cceb1940846604f0",
        "canonical_item_id": "pnu-academic-ite-career-13815:1153895",
        "is_canonical": false,
        "same_notice_source_ids": [
          "pnu-academic-ite-career-13815",
          "pnu-academic-ite-general-13812"
        ],
        "source_name": "부산대 IT응용공학과 공지사항",
        "content_access": {
          "detail_url": "https://ite.pusan.ac.kr/bbs/ite/1784/1153895/artclView.do",
          "requires_login": false,
          "content_mirrored": false,
          "attachments_mirrored": false
        },
        "tags": [
          "pnu",
          "official",
          "academic_unit",
          "college_department",
          "department_notice",
          "general"
        ],
        "source_category": "academic_unit_notice",
        "source_tags": [
          "pnu",
          "official",
          "academic_unit",
          "college_department",
          "department_notice",
          "general"
        ],
        "topics": []
      },
      "content_text": "This feed does not mirror the full notice body. Fetch the original notice URL for complete content.",
      "summary": null,
      "date_published": "2011-06-03T00:00:00+09:00",
      "_archive": {
        "archive_month": "2011-06",
        "first_seen_at": "2026-06-06T10:31:15+09:00",
        "last_seen_at": "2026-06-06T10:31:15+09:00",
        "last_changed_at": "2026-06-06T10:31:15+09:00",
        "current_content_hash": "ce8653bf9cccb81845ac92b990ac6cd820f2db7707a492e990e5a68ce1685d15",
        "baseline_imported_at": "2026-06-06T10:31:15+09:00"
      }
    },
    {
      "id": "pnu-academic-ite-career-13815:1153895",
      "url": "https://ite.pusan.ac.kr/bbs/ite/1784/1153895/artclView.do",
      "title": "IT응용공학과 교육과정표(2025교육과정_업데이트)",
      "_pnu": {
        "source_id": "pnu-academic-ite-career-13815",
        "published_at": "2011-06-03",
        "fetched_at": "2026-06-06T13:24:36+09:00",
        "snippet": null,
        "attachments": [],
        "content_hash": "ce8653bf9cccb81845ac92b990ac6cd820f2db7707a492e990e5a68ce1685d15",
        "same_notice_group_id": "same_notice:cceb1940846604f0",
        "canonical_item_id": "pnu-academic-ite-career-13815:1153895",
        "is_canonical": true,
        "same_notice_source_ids": [
          "pnu-academic-ite-career-13815",
          "pnu-academic-ite-general-13812"
        ],
        "source_name": "부산대 IT응용공학과 취업정보",
        "content_access": {
          "detail_url": "https://ite.pusan.ac.kr/bbs/ite/1784/1153895/artclView.do",
          "requires_login": false,
          "content_mirrored": false,
          "attachments_mirrored": false
        },
        "tags": [
          "pnu",
          "official",
          "academic_unit",
          "college_department",
          "department_notice",
          "career"
        ],
        "source_category": "academic_unit_career_notice",
        "source_tags": [
          "pnu",
          "official",
          "academic_unit",
          "college_department",
          "department_notice",
          "career"
        ],
        "topics": [
          "career"
        ]
      },
      "content_text": "This feed does not mirror the full notice body. Fetch the original notice URL for complete content.",
      "summary": null,
      "date_published": "2011-06-03T00:00:00+09:00",
      "_archive": {
        "archive_month": "2011-06",
        "first_seen_at": "2026-06-06T13:24:36+09:00",
        "last_seen_at": "2026-06-06T13:24:36+09:00",
        "last_changed_at": "2026-06-06T13:24:36+09:00",
        "current_content_hash": "ce8653bf9cccb81845ac92b990ac6cd820f2db7707a492e990e5a68ce1685d15",
        "baseline_imported_at": "2026-06-06T13:24:36+09:00"
      }
    }
  ],
  "events": []
}
