{
  "schema_version": "0.1",
  "archive_version": "0.4",
  "archive_type": "month",
  "archive_month": "2007-12",
  "last_modified_at": "2026-06-06T13:51:13+09:00",
  "timezone": "Asia/Seoul",
  "item_count": 1,
  "event_count": 0,
  "source_counts": {
    "pnu-academic-fst-general-10298": 1
  },
  "items": [
    {
      "id": "pnu-academic-fst-general-10298:1344886",
      "url": "https://fst.pusan.ac.kr/bbs/fst/826/1344886/artclView.do",
      "title": "[학사규정] 식품공학전공학생의 장학 및 전과(개정)",
      "content_text": "This feed does not mirror the full notice body. Fetch the original notice URL for complete content.",
      "summary": null,
      "date_published": "2007-12-10T00:00:00+09:00",
      "_pnu": {
        "source_id": "pnu-academic-fst-general-10298",
        "source_name": "부산대 식품공학과 공지사항",
        "published_at": "2007-12-10",
        "fetched_at": "2026-06-06T10:31:15+09:00",
        "snippet": null,
        "content_access": {
          "detail_url": "https://fst.pusan.ac.kr/bbs/fst/826/1344886/artclView.do",
          "requires_login": false,
          "content_mirrored": false,
          "attachments_mirrored": false
        },
        "attachments": [],
        "tags": [
          "pnu",
          "official",
          "academic_unit",
          "college_department",
          "department_notice",
          "general"
        ],
        "content_hash": "88a69876c17d2af8b405f71c38709b628e2925deaee93cff2ab16da54b2052f0",
        "source_category": "academic_unit_notice",
        "source_tags": [
          "pnu",
          "official",
          "academic_unit",
          "college_department",
          "department_notice",
          "general"
        ],
        "topics": [
          "scholarship",
          "academic_records"
        ],
        "same_notice_group_id": null,
        "canonical_item_id": "pnu-academic-fst-general-10298:1344886",
        "is_canonical": true,
        "same_notice_source_ids": [
          "pnu-academic-fst-general-10298"
        ]
      },
      "_archive": {
        "archive_month": "2007-12",
        "first_seen_at": "2026-06-06T10:31:15+09:00",
        "last_seen_at": "2026-06-06T10:31:15+09:00",
        "last_changed_at": "2026-06-06T10:31:15+09:00",
        "current_content_hash": "88a69876c17d2af8b405f71c38709b628e2925deaee93cff2ab16da54b2052f0",
        "baseline_imported_at": "2026-06-06T10:31:15+09:00"
      }
    }
  ],
  "events": []
}
