{
  "schema_version": "0.1",
  "archive_version": "0.2",
  "archive_type": "month",
  "archive_month": "2023-03",
  "last_modified_at": "2026-06-05T14:52:35+09:00",
  "timezone": "Asia/Seoul",
  "item_count": 1,
  "event_count": 0,
  "source_counts": {
    "pnu-lei-korean-course-notices": 1
  },
  "items": [
    {
      "id": "pnu-lei-korean-course-notices:274",
      "url": "https://lei.pusan.ac.kr/page?menuCD=000000000000226&mode=DETAIL&seq=274&typeSeqNo=1&mainbbsTabIndex=0&cateSeq=9",
      "title": "[언어교육원] 2023학년도 1학기 언어교육원 홍보대사 모집 안내",
      "content_text": "This feed does not mirror the full notice body. Fetch the original notice URL for complete content.",
      "summary": "2023학년도 1학기 언어교육원 홍보대사 를 붙임과 같이 모집하오니 창의적이고 진취적인 행동력을 겸비한 부산대학교 재학생 분들의 많은 관심과 지원 부탁드립니다 신청기간 : 2023. 3. 20.(월) ~ 2023. 3. 29.(수) 신청방법 : 학생지원시스템-학생역량-비교과프로그램-언어교육원 홍보대사 모집인원 : 4명 ※ [붙임] 2023학년도 1학기 언어교육원 홍보대사 모집 안내 1부 참조",
      "date_published": "2023-03-21T00:00:00+09:00",
      "_pnu": {
        "source_id": "pnu-lei-korean-course-notices",
        "source_name": "부산대 언어교육원 한국어과정 공지사항",
        "published_at": "2023-03-21",
        "fetched_at": "2026-06-05T14:52:35+09:00",
        "snippet": "2023학년도 1학기 언어교육원 홍보대사 를 붙임과 같이 모집하오니 창의적이고 진취적인 행동력을 겸비한 부산대학교 재학생 분들의 많은 관심과 지원 부탁드립니다 신청기간 : 2023. 3. 20.(월) ~ 2023. 3. 29.(수) 신청방법 : 학생지원시스템-학생역량-비교과프로그램-언어교육원 홍보대사 모집인원 : 4명 ※ [붙임] 2023학년도 1학기 언어교육원 홍보대사 모집 안내 1부 참조",
        "content_access": {
          "detail_url": "https://lei.pusan.ac.kr/page?menuCD=000000000000226&mode=DETAIL&seq=274&typeSeqNo=1&mainbbsTabIndex=0&cateSeq=9",
          "requires_login": false,
          "content_mirrored": false,
          "attachments_mirrored": false
        },
        "attachments": [
          {
            "name": "2023학년도 1학기 언어교육원 홍보대사 모집 안내.hwp",
            "url": "https://lei.pusan.ac.kr/file/download.do?lwjG/vA7+Wv778AOzB3KyAblgbW5qdXC/0hRb1fQI+sQLwNwYLCY8Pp/rup9+KxHhjX2DuqQl8eRctSxtVYRSw==",
            "download_url": "https://lei.pusan.ac.kr/file/download.do?lwjG/vA7+Wv778AOzB3KyAblgbW5qdXC/0hRb1fQI+sQLwNwYLCY8Pp/rup9+KxHhjX2DuqQl8eRctSxtVYRSw==",
            "type": "tmp",
            "media_type": null,
            "file_extension": "tmp"
          }
        ],
        "tags": [
          "pnu",
          "official",
          "language_education",
          "korean_course"
        ],
        "content_hash": "1e8f99500c18711b90a80d8dca72dd6a86105753fc5ee8720daf83192d6aa98a"
      },
      "_archive": {
        "archive_month": "2023-03",
        "first_seen_at": "2026-06-05T14:52:35+09:00",
        "last_seen_at": "2026-06-05T14:52:35+09:00",
        "last_changed_at": "2026-06-05T14:52:35+09:00",
        "current_content_hash": "1e8f99500c18711b90a80d8dca72dd6a86105753fc5ee8720daf83192d6aa98a"
      }
    }
  ],
  "events": []
}
