{
  "schema_version": "0.1",
  "archive_version": "0.3",
  "archive_type": "month",
  "archive_month": "2016-02",
  "last_modified_at": "2026-06-06T10:31:15+09:00",
  "timezone": "Asia/Seoul",
  "item_count": 1,
  "event_count": 0,
  "source_counts": {
    "pnu-academic-swf-class-13751": 1
  },
  "items": [
    {
      "id": "pnu-academic-swf-class-13751:1251447",
      "url": "https://swf.pusan.ac.kr/bbs/swf/1814/1251447/artclView.do",
      "title": "[사회복지조사론] 교재 변경 관련 공지",
      "content_text": "This feed does not mirror the full notice body. Fetch the original notice URL for complete content.",
      "summary": null,
      "date_published": "2016-02-29T00:00:00+09:00",
      "_pnu": {
        "source_id": "pnu-academic-swf-class-13751",
        "source_name": "부산대 사회복지학과 수업공지",
        "published_at": "2016-02-29",
        "fetched_at": "2026-06-06T10:31:15+09:00",
        "snippet": null,
        "content_access": {
          "detail_url": "https://swf.pusan.ac.kr/bbs/swf/1814/1251447/artclView.do",
          "requires_login": false,
          "content_mirrored": false,
          "attachments_mirrored": false
        },
        "attachments": [],
        "tags": [
          "pnu",
          "official",
          "academic_unit",
          "college_department",
          "department_notice",
          "class"
        ],
        "content_hash": "812e8cd42dba34e19e90800a0170c7f14f7aff4cf3b59cbb41a0b8f46641ea13",
        "source_category": "academic_unit_class_notice",
        "source_tags": [
          "pnu",
          "official",
          "academic_unit",
          "college_department",
          "department_notice",
          "class"
        ],
        "topics": [
          "course"
        ],
        "same_notice_group_id": null,
        "canonical_item_id": "pnu-academic-swf-class-13751:1251447",
        "is_canonical": true,
        "same_notice_source_ids": [
          "pnu-academic-swf-class-13751"
        ]
      },
      "_archive": {
        "archive_month": "2016-02",
        "first_seen_at": "2026-06-06T10:31:15+09:00",
        "last_seen_at": "2026-06-06T10:31:15+09:00",
        "last_changed_at": "2026-06-06T10:31:15+09:00",
        "current_content_hash": "812e8cd42dba34e19e90800a0170c7f14f7aff4cf3b59cbb41a0b8f46641ea13",
        "baseline_imported_at": "2026-06-06T10:31:15+09:00"
      }
    }
  ],
  "events": []
}
