{
  "schema_version": "0.1",
  "archive_version": "0.3",
  "archive_type": "month",
  "archive_month": "2015-04",
  "last_modified_at": "2026-06-06T10:31:15+09:00",
  "timezone": "Asia/Seoul",
  "item_count": 2,
  "event_count": 0,
  "source_counts": {
    "pnu-academic-cse-general-14221": 1,
    "pnu-academic-math-undergrad-11218": 1
  },
  "items": [
    {
      "id": "pnu-academic-cse-general-14221:1384055",
      "url": "https://cse.pusan.ac.kr/bbs/cse/2055/1384055/artclView.do",
      "title": "학과활동인정 외부행사/세미나 안내",
      "content_text": "This feed does not mirror the full notice body. Fetch the original notice URL for complete content.",
      "summary": null,
      "date_published": "2015-04-07T00:00:00+09:00",
      "_pnu": {
        "source_id": "pnu-academic-cse-general-14221",
        "source_name": "부산대 정보컴퓨터공학부 공지사항",
        "published_at": "2015-04-07",
        "fetched_at": "2026-06-06T10:31:15+09:00",
        "snippet": null,
        "content_access": {
          "detail_url": "https://cse.pusan.ac.kr/bbs/cse/2055/1384055/artclView.do",
          "requires_login": false,
          "content_mirrored": false,
          "attachments_mirrored": false
        },
        "attachments": [],
        "tags": [
          "pnu",
          "official",
          "academic_unit",
          "college_department",
          "department_notice",
          "general"
        ],
        "content_hash": "3fb4cea833ef2446b6b23500e6a91aebf7cf25062d0b0fc4a779e8a9f79ffc1e",
        "source_category": "academic_unit_notice",
        "source_tags": [
          "pnu",
          "official",
          "academic_unit",
          "college_department",
          "department_notice",
          "general"
        ],
        "topics": [],
        "same_notice_group_id": null,
        "canonical_item_id": "pnu-academic-cse-general-14221:1384055",
        "is_canonical": true,
        "same_notice_source_ids": [
          "pnu-academic-cse-general-14221"
        ]
      },
      "_archive": {
        "archive_month": "2015-04",
        "first_seen_at": "2026-06-06T10:31:15+09:00",
        "last_seen_at": "2026-06-06T10:31:15+09:00",
        "last_changed_at": "2026-06-06T10:31:15+09:00",
        "current_content_hash": "3fb4cea833ef2446b6b23500e6a91aebf7cf25062d0b0fc4a779e8a9f79ffc1e",
        "baseline_imported_at": "2026-06-06T10:31:15+09:00"
      }
    },
    {
      "id": "pnu-academic-math-undergrad-11218:1074963",
      "url": "https://math.pusan.ac.kr/bbs/math/867/1074963/artclView.do",
      "title": "장학금 수혜자 자퇴처리 업무 알림",
      "content_text": "This feed does not mirror the full notice body. Fetch the original notice URL for complete content.",
      "summary": null,
      "date_published": "2015-04-02T00:00:00+09:00",
      "_pnu": {
        "source_id": "pnu-academic-math-undergrad-11218",
        "source_name": "부산대 수학과 학부공지",
        "published_at": "2015-04-02",
        "fetched_at": "2026-06-06T10:31:15+09:00",
        "snippet": null,
        "content_access": {
          "detail_url": "https://math.pusan.ac.kr/bbs/math/867/1074963/artclView.do",
          "requires_login": false,
          "content_mirrored": false,
          "attachments_mirrored": false
        },
        "attachments": [],
        "tags": [
          "pnu",
          "official",
          "academic_unit",
          "college_department",
          "department_notice",
          "undergrad"
        ],
        "content_hash": "911d9fb5227c6d327d8fcc0e3bc7dd62eec2c6804dcd6456f138a3edef131837",
        "source_category": "academic_unit_undergraduate_notice",
        "source_tags": [
          "pnu",
          "official",
          "academic_unit",
          "college_department",
          "department_notice",
          "undergrad"
        ],
        "topics": [
          "undergraduate",
          "scholarship"
        ],
        "same_notice_group_id": null,
        "canonical_item_id": "pnu-academic-math-undergrad-11218:1074963",
        "is_canonical": true,
        "same_notice_source_ids": [
          "pnu-academic-math-undergrad-11218"
        ]
      },
      "_archive": {
        "archive_month": "2015-04",
        "first_seen_at": "2026-06-06T10:31:15+09:00",
        "last_seen_at": "2026-06-06T10:31:15+09:00",
        "last_changed_at": "2026-06-06T10:31:15+09:00",
        "current_content_hash": "911d9fb5227c6d327d8fcc0e3bc7dd62eec2c6804dcd6456f138a3edef131837",
        "baseline_imported_at": "2026-06-06T10:31:15+09:00"
      }
    }
  ],
  "events": []
}
