{
  "schema_version": "0.1",
  "archive_version": "0.4",
  "archive_type": "month",
  "archive_month": "2012-02",
  "last_modified_at": "2026-10-26T10:25:21+09:00",
  "timezone": "Asia/Seoul",
  "item_count": 1,
  "event_count": 0,
  "source_counts": {
    "pnu-academic-math-career-11232": 1
  },
  "items": [
    {
      "id": "pnu-academic-math-career-11232:1077689",
      "url": "https://math.pusan.ac.kr/bbs/math/1392/1077689/artclView.do",
      "title": "<학원강사(업데이트 10/22)>",
      "_pnu": {
        "source_id": "pnu-academic-math-career-11232",
        "published_at": "2012-02-27",
        "fetched_at": "2026-10-26T10:25:21+09:00",
        "snippet": null,
        "attachments": [],
        "content_hash": "869bd50a0688ff07af0ceda910a3708d5ed32eb79c49633de3fb66f78876bbc1",
        "same_notice_group_id": null,
        "canonical_item_id": "pnu-academic-math-career-11232:1077689",
        "is_canonical": true,
        "same_notice_source_ids": [
          "pnu-academic-math-career-11232"
        ],
        "source_name": "부산대 수학과 취업관련",
        "content_access": {
          "detail_url": "https://math.pusan.ac.kr/bbs/math/1392/1077689/artclView.do",
          "requires_login": false,
          "content_mirrored": false,
          "attachments_mirrored": false
        },
        "tags": [
          "pnu",
          "official",
          "academic_unit",
          "college_department",
          "department_notice",
          "career"
        ],
        "source_category": "academic_unit_career_notice",
        "source_tags": [
          "pnu",
          "official",
          "academic_unit",
          "college_department",
          "department_notice",
          "career"
        ],
        "topics": [
          "career"
        ]
      },
      "content_text": "This feed does not mirror the full notice body. Fetch the original notice URL for complete content.",
      "summary": null,
      "date_published": "2012-02-27T00:00:00+09:00",
      "_archive": {
        "archive_month": "2012-02",
        "first_seen_at": "2026-06-06T13:24:36+09:00",
        "last_seen_at": "2026-10-26T10:25:21+09:00",
        "last_changed_at": "2026-10-26T10:25:21+09:00",
        "current_content_hash": "869bd50a0688ff07af0ceda910a3708d5ed32eb79c49633de3fb66f78876bbc1",
        "baseline_imported_at": "2026-06-06T13:24:36+09:00"
      }
    }
  ],
  "events": []
}
