{
  "schema_version": "0.1",
  "archive_version": "0.3",
  "archive_type": "month",
  "archive_month": "2018-11",
  "last_modified_at": "2026-06-06T10:31:15+09:00",
  "timezone": "Asia/Seoul",
  "item_count": 4,
  "event_count": 0,
  "source_counts": {
    "pnu-academic-ie-general-5854": 1,
    "pnu-academic-plant-general-7376": 2,
    "pnu-academic-art-general-1518": 1
  },
  "items": [
    {
      "id": "pnu-academic-ie-general-5854:1182538",
      "url": "https://ie.pusan.ac.kr/bbs/ie/661/1182538/artclView.do",
      "title": "동문회비 납부 안내",
      "content_text": "This feed does not mirror the full notice body. Fetch the original notice URL for complete content.",
      "summary": null,
      "date_published": "2018-11-29T00:00:00+09:00",
      "_pnu": {
        "source_id": "pnu-academic-ie-general-5854",
        "source_name": "부산대 산업공학과 공지사항",
        "published_at": "2018-11-29",
        "fetched_at": "2026-06-06T10:31:15+09:00",
        "snippet": null,
        "content_access": {
          "detail_url": "https://ie.pusan.ac.kr/bbs/ie/661/1182538/artclView.do",
          "requires_login": false,
          "content_mirrored": false,
          "attachments_mirrored": false
        },
        "attachments": [],
        "tags": [
          "pnu",
          "official",
          "academic_unit",
          "college_department",
          "department_notice",
          "general"
        ],
        "content_hash": "d1c07198000e89eee0993239db3786e6716e10d82a44b612e027d2312a7bb009",
        "source_category": "academic_unit_notice",
        "source_tags": [
          "pnu",
          "official",
          "academic_unit",
          "college_department",
          "department_notice",
          "general"
        ],
        "topics": [],
        "same_notice_group_id": null,
        "canonical_item_id": "pnu-academic-ie-general-5854:1182538",
        "is_canonical": true,
        "same_notice_source_ids": [
          "pnu-academic-ie-general-5854"
        ]
      },
      "_archive": {
        "archive_month": "2018-11",
        "first_seen_at": "2026-06-06T10:31:15+09:00",
        "last_seen_at": "2026-06-06T10:31:15+09:00",
        "last_changed_at": "2026-06-06T10:31:15+09:00",
        "current_content_hash": "d1c07198000e89eee0993239db3786e6716e10d82a44b612e027d2312a7bb009",
        "baseline_imported_at": "2026-06-06T10:31:15+09:00"
      }
    },
    {
      "id": "pnu-academic-plant-general-7376:1097984",
      "url": "https://plant.pusan.ac.kr/bbs/plant/877/1097984/artclView.do",
      "title": "2019학년도 전기 일반대학원 신입생 모집요강 및 전형 일정 안내",
      "content_text": "This feed does not mirror the full notice body. Fetch the original notice URL for complete content.",
      "summary": null,
      "date_published": "2018-11-15T00:00:00+09:00",
      "_pnu": {
        "source_id": "pnu-academic-plant-general-7376",
        "source_name": "부산대 식물생명과학과 공지사항",
        "published_at": "2018-11-15",
        "fetched_at": "2026-06-06T10:31:15+09:00",
        "snippet": null,
        "content_access": {
          "detail_url": "https://plant.pusan.ac.kr/bbs/plant/877/1097984/artclView.do",
          "requires_login": false,
          "content_mirrored": false,
          "attachments_mirrored": false
        },
        "attachments": [],
        "tags": [
          "pnu",
          "official",
          "academic_unit",
          "college_department",
          "department_notice",
          "general"
        ],
        "content_hash": "f68f6d8f444217b7a34208b824a6c813521051547be4f36303cbd283ae64e5d9",
        "source_category": "academic_unit_notice",
        "source_tags": [
          "pnu",
          "official",
          "academic_unit",
          "college_department",
          "department_notice",
          "general"
        ],
        "topics": [
          "graduate"
        ],
        "same_notice_group_id": null,
        "canonical_item_id": "pnu-academic-plant-general-7376:1097984",
        "is_canonical": true,
        "same_notice_source_ids": [
          "pnu-academic-plant-general-7376"
        ]
      },
      "_archive": {
        "archive_month": "2018-11",
        "first_seen_at": "2026-06-06T10:31:15+09:00",
        "last_seen_at": "2026-06-06T10:31:15+09:00",
        "last_changed_at": "2026-06-06T10:31:15+09:00",
        "current_content_hash": "f68f6d8f444217b7a34208b824a6c813521051547be4f36303cbd283ae64e5d9",
        "baseline_imported_at": "2026-06-06T10:31:15+09:00"
      }
    },
    {
      "id": "pnu-academic-art-general-1518:895423",
      "url": "https://art.pusan.ac.kr/bbs/art/82/895423/artclView.do",
      "title": "[입시] 2019학년도 전기 일반대학원 모집요강 안내",
      "content_text": "This feed does not mirror the full notice body. Fetch the original notice URL for complete content.",
      "summary": null,
      "date_published": "2018-11-13T00:00:00+09:00",
      "_pnu": {
        "source_id": "pnu-academic-art-general-1518",
        "source_name": "부산대 예술대학 공지사항",
        "published_at": "2018-11-13",
        "fetched_at": "2026-06-06T10:31:15+09:00",
        "snippet": null,
        "content_access": {
          "detail_url": "https://art.pusan.ac.kr/bbs/art/82/895423/artclView.do",
          "requires_login": false,
          "content_mirrored": false,
          "attachments_mirrored": false
        },
        "attachments": [],
        "tags": [
          "pnu",
          "official",
          "academic_unit",
          "college_department",
          "college_notice",
          "general"
        ],
        "content_hash": "dc97afa2ff705d8572afaea4fac92badc6e7c0b519a7832c732b6d11cc2bfb32",
        "source_category": "academic_unit_notice",
        "source_tags": [
          "pnu",
          "official",
          "academic_unit",
          "college_department",
          "college_notice",
          "general"
        ],
        "topics": [
          "graduate"
        ],
        "same_notice_group_id": null,
        "canonical_item_id": "pnu-academic-art-general-1518:895423",
        "is_canonical": true,
        "same_notice_source_ids": [
          "pnu-academic-art-general-1518"
        ]
      },
      "_archive": {
        "archive_month": "2018-11",
        "first_seen_at": "2026-06-06T10:31:15+09:00",
        "last_seen_at": "2026-06-06T10:31:15+09:00",
        "last_changed_at": "2026-06-06T10:31:15+09:00",
        "current_content_hash": "dc97afa2ff705d8572afaea4fac92badc6e7c0b519a7832c732b6d11cc2bfb32",
        "baseline_imported_at": "2026-06-06T10:31:15+09:00"
      }
    },
    {
      "id": "pnu-academic-plant-general-7376:1097983",
      "url": "https://plant.pusan.ac.kr/bbs/plant/877/1097983/artclView.do",
      "title": "2019학년도 상반기 전임교원 신규채용 공개강의 일정 안내",
      "content_text": "This feed does not mirror the full notice body. Fetch the original notice URL for complete content.",
      "summary": null,
      "date_published": "2018-11-08T00:00:00+09:00",
      "_pnu": {
        "source_id": "pnu-academic-plant-general-7376",
        "source_name": "부산대 식물생명과학과 공지사항",
        "published_at": "2018-11-08",
        "fetched_at": "2026-06-06T10:31:15+09:00",
        "snippet": null,
        "content_access": {
          "detail_url": "https://plant.pusan.ac.kr/bbs/plant/877/1097983/artclView.do",
          "requires_login": false,
          "content_mirrored": false,
          "attachments_mirrored": false
        },
        "attachments": [],
        "tags": [
          "pnu",
          "official",
          "academic_unit",
          "college_department",
          "department_notice",
          "general"
        ],
        "content_hash": "5bd806b97f3256e60e5ae577022ddd65695729b9be8b42e6d5a5279a369118f3",
        "source_category": "academic_unit_notice",
        "source_tags": [
          "pnu",
          "official",
          "academic_unit",
          "college_department",
          "department_notice",
          "general"
        ],
        "topics": [
          "recruitment",
          "course"
        ],
        "same_notice_group_id": null,
        "canonical_item_id": "pnu-academic-plant-general-7376:1097983",
        "is_canonical": true,
        "same_notice_source_ids": [
          "pnu-academic-plant-general-7376"
        ]
      },
      "_archive": {
        "archive_month": "2018-11",
        "first_seen_at": "2026-06-06T10:31:15+09:00",
        "last_seen_at": "2026-06-06T10:31:15+09:00",
        "last_changed_at": "2026-06-06T10:31:15+09:00",
        "current_content_hash": "5bd806b97f3256e60e5ae577022ddd65695729b9be8b42e6d5a5279a369118f3",
        "baseline_imported_at": "2026-06-06T10:31:15+09:00"
      }
    }
  ],
  "events": []
}
