{
  "schema_version": "0.1",
  "archive_version": "0.2",
  "archive_type": "month",
  "archive_month": "2020-06",
  "last_modified_at": "2026-06-05T10:35:31+09:00",
  "timezone": "Asia/Seoul",
  "item_count": 1,
  "event_count": 0,
  "source_counts": {
    "pnu-job-notices": 1
  },
  "items": [
    {
      "id": "pnu-job-notices:23983",
      "url": "https://job.pusan.ac.kr/ko/notice/notice/view/23983?p=1",
      "title": "취업 관련 온라인 사이트 무료 이용 안내",
      "content_text": "This feed does not mirror the full notice body. Fetch the original notice URL for complete content.",
      "summary": null,
      "date_published": "2020-06-02T00:00:00+09:00",
      "_pnu": {
        "source_id": "pnu-job-notices",
        "source_name": "부산대 취업전략과 공지사항",
        "published_at": "2020-06-02",
        "fetched_at": "2026-06-05T10:35:31+09:00",
        "snippet": null,
        "content_access": {
          "detail_url": "https://job.pusan.ac.kr/ko/notice/notice/view/23983?p=1",
          "requires_login": false,
          "content_mirrored": false,
          "attachments_mirrored": false
        },
        "attachments": [],
        "tags": [
          "pnu",
          "official",
          "career",
          "job_notice"
        ],
        "content_hash": "130a2989ca40be70ed7e9d07a72c4841436aaa219c80cf88250dfe821d2dad83"
      },
      "_archive": {
        "archive_month": "2020-06",
        "first_seen_at": "2026-06-05T10:35:31+09:00",
        "last_seen_at": "2026-06-05T10:35:31+09:00",
        "last_changed_at": "2026-06-05T10:35:31+09:00",
        "current_content_hash": "130a2989ca40be70ed7e9d07a72c4841436aaa219c80cf88250dfe821d2dad83"
      }
    }
  ],
  "events": []
}
