{
  "schema_version": "0.1",
  "archive_version": "0.3",
  "archive_type": "month",
  "archive_month": "2018-09",
  "last_modified_at": "2026-06-06T10:31:15+09:00",
  "timezone": "Asia/Seoul",
  "item_count": 3,
  "event_count": 0,
  "source_counts": {
    "pnu-academic-pnuart-general-13910": 1,
    "pnu-academic-swf-scholarship-13750": 1,
    "pnu-academic-eehome-grad-3029": 1
  },
  "items": [
    {
      "id": "pnu-academic-pnuart-general-13910:1341304",
      "url": "https://pnuart.pusan.ac.kr/bbs/pnuart/1847/1341304/artclView.do",
      "title": "교육대학원 신입생 모집요강(안)",
      "content_text": "This feed does not mirror the full notice body. Fetch the original notice URL for complete content.",
      "summary": null,
      "date_published": "2018-09-28T00:00:00+09:00",
      "_pnu": {
        "source_id": "pnu-academic-pnuart-general-13910",
        "source_name": "부산대 미술학과 공지사항",
        "published_at": "2018-09-28",
        "fetched_at": "2026-06-06T10:31:15+09:00",
        "snippet": null,
        "content_access": {
          "detail_url": "https://pnuart.pusan.ac.kr/bbs/pnuart/1847/1341304/artclView.do",
          "requires_login": false,
          "content_mirrored": false,
          "attachments_mirrored": false
        },
        "attachments": [],
        "tags": [
          "pnu",
          "official",
          "academic_unit",
          "college_department",
          "department_notice",
          "general"
        ],
        "content_hash": "b04b333f173ebbcfd56089163f9cef1537758a406af63fd27ba804a3d3ddfc7f",
        "source_category": "academic_unit_notice",
        "source_tags": [
          "pnu",
          "official",
          "academic_unit",
          "college_department",
          "department_notice",
          "general"
        ],
        "topics": [
          "graduate"
        ],
        "same_notice_group_id": null,
        "canonical_item_id": "pnu-academic-pnuart-general-13910:1341304",
        "is_canonical": true,
        "same_notice_source_ids": [
          "pnu-academic-pnuart-general-13910"
        ]
      },
      "_archive": {
        "archive_month": "2018-09",
        "first_seen_at": "2026-06-06T10:31:15+09:00",
        "last_seen_at": "2026-06-06T10:31:15+09:00",
        "last_changed_at": "2026-06-06T10:31:15+09:00",
        "current_content_hash": "b04b333f173ebbcfd56089163f9cef1537758a406af63fd27ba804a3d3ddfc7f",
        "baseline_imported_at": "2026-06-06T10:31:15+09:00"
      }
    },
    {
      "id": "pnu-academic-swf-scholarship-13750:1251234",
      "url": "https://swf.pusan.ac.kr/bbs/swf/1813/1251234/artclView.do",
      "title": "국가장학금 신청자 가구원 동의 안내",
      "content_text": "This feed does not mirror the full notice body. Fetch the original notice URL for complete content.",
      "summary": null,
      "date_published": "2018-09-14T00:00:00+09:00",
      "_pnu": {
        "source_id": "pnu-academic-swf-scholarship-13750",
        "source_name": "부산대 사회복지학과 장학공지",
        "published_at": "2018-09-14",
        "fetched_at": "2026-06-06T10:31:15+09:00",
        "snippet": null,
        "content_access": {
          "detail_url": "https://swf.pusan.ac.kr/bbs/swf/1813/1251234/artclView.do",
          "requires_login": false,
          "content_mirrored": false,
          "attachments_mirrored": false
        },
        "attachments": [],
        "tags": [
          "pnu",
          "official",
          "academic_unit",
          "college_department",
          "department_notice",
          "scholarship"
        ],
        "content_hash": "c076cfbb67b097465adbb7cf66b95c4c64c01b23723c8ac5303d3595175bc627",
        "source_category": "academic_unit_scholarship_notice",
        "source_tags": [
          "pnu",
          "official",
          "academic_unit",
          "college_department",
          "department_notice",
          "scholarship"
        ],
        "topics": [
          "scholarship"
        ],
        "same_notice_group_id": null,
        "canonical_item_id": "pnu-academic-swf-scholarship-13750:1251234",
        "is_canonical": true,
        "same_notice_source_ids": [
          "pnu-academic-swf-scholarship-13750"
        ]
      },
      "_archive": {
        "archive_month": "2018-09",
        "first_seen_at": "2026-06-06T10:31:15+09:00",
        "last_seen_at": "2026-06-06T10:31:15+09:00",
        "last_changed_at": "2026-06-06T10:31:15+09:00",
        "current_content_hash": "c076cfbb67b097465adbb7cf66b95c4c64c01b23723c8ac5303d3595175bc627",
        "baseline_imported_at": "2026-06-06T10:31:15+09:00"
      }
    },
    {
      "id": "pnu-academic-eehome-grad-3029:899454",
      "url": "https://eec.pusan.ac.kr/bbs/eehome/302/899454/artclView.do",
      "title": "산업대학원 전자전기공학전공 폐지 알림",
      "content_text": "This feed does not mirror the full notice body. Fetch the original notice URL for complete content.",
      "summary": null,
      "date_published": "2018-09-07T00:00:00+09:00",
      "_pnu": {
        "source_id": "pnu-academic-eehome-grad-3029",
        "source_name": "부산대 전기공학전공 대학원공지",
        "published_at": "2018-09-07",
        "fetched_at": "2026-06-06T10:31:15+09:00",
        "snippet": null,
        "content_access": {
          "detail_url": "https://eec.pusan.ac.kr/bbs/eehome/302/899454/artclView.do",
          "requires_login": false,
          "content_mirrored": false,
          "attachments_mirrored": false
        },
        "attachments": [],
        "tags": [
          "pnu",
          "official",
          "academic_unit",
          "college_department",
          "department_notice",
          "grad"
        ],
        "content_hash": "864eb94ad58cee7ce7991eddc2dfdf14702f594f387e66f15dd016713fe44212",
        "source_category": "academic_unit_graduate_notice",
        "source_tags": [
          "pnu",
          "official",
          "academic_unit",
          "college_department",
          "department_notice",
          "grad"
        ],
        "topics": [
          "graduate"
        ],
        "same_notice_group_id": null,
        "canonical_item_id": "pnu-academic-eehome-grad-3029:899454",
        "is_canonical": true,
        "same_notice_source_ids": [
          "pnu-academic-eehome-grad-3029"
        ]
      },
      "_archive": {
        "archive_month": "2018-09",
        "first_seen_at": "2026-06-06T10:31:15+09:00",
        "last_seen_at": "2026-06-06T10:31:15+09:00",
        "last_changed_at": "2026-06-06T10:31:15+09:00",
        "current_content_hash": "864eb94ad58cee7ce7991eddc2dfdf14702f594f387e66f15dd016713fe44212",
        "baseline_imported_at": "2026-06-06T10:31:15+09:00"
      }
    }
  ],
  "events": []
}
