{
  "schema_version": "0.1",
  "archive_version": "0.4",
  "archive_type": "month",
  "archive_month": "2011-10",
  "last_modified_at": "2026-06-06T13:51:13+09:00",
  "timezone": "Asia/Seoul",
  "item_count": 2,
  "event_count": 0,
  "source_counts": {
    "pnu-academic-geology-general-3212": 1,
    "pnu-academic-geology-career-3225": 1
  },
  "items": [
    {
      "id": "pnu-academic-geology-general-3212:1321437",
      "url": "https://geology.pusan.ac.kr/bbs/geology/156/1321437/artclView.do",
      "title": "[필독] 홈페이지 사용 관련, 사용신청",
      "_pnu": {
        "source_id": "pnu-academic-geology-general-3212",
        "published_at": "2011-10-21",
        "fetched_at": "2026-06-06T10:31:15+09:00",
        "snippet": null,
        "attachments": [],
        "content_hash": "5c6a112bf698eaf06b89dcb7e60eb2a2254b8f12732671c331d4a8a4858be165",
        "same_notice_group_id": "same_notice:149d75fe4d347ea3",
        "canonical_item_id": "pnu-academic-geology-career-3225:1321437",
        "is_canonical": false,
        "same_notice_source_ids": [
          "pnu-academic-geology-career-3225",
          "pnu-academic-geology-general-3212"
        ],
        "source_name": "부산대 지질환경과학과 공지사항",
        "content_access": {
          "detail_url": "https://geology.pusan.ac.kr/bbs/geology/156/1321437/artclView.do",
          "requires_login": false,
          "content_mirrored": false,
          "attachments_mirrored": false
        },
        "tags": [
          "pnu",
          "official",
          "academic_unit",
          "college_department",
          "department_notice",
          "general"
        ],
        "source_category": "academic_unit_notice",
        "source_tags": [
          "pnu",
          "official",
          "academic_unit",
          "college_department",
          "department_notice",
          "general"
        ],
        "topics": []
      },
      "content_text": "This feed does not mirror the full notice body. Fetch the original notice URL for complete content.",
      "summary": null,
      "date_published": "2011-10-21T00:00:00+09:00",
      "_archive": {
        "archive_month": "2011-10",
        "first_seen_at": "2026-06-06T10:31:15+09:00",
        "last_seen_at": "2026-06-06T10:31:15+09:00",
        "last_changed_at": "2026-06-06T10:31:15+09:00",
        "current_content_hash": "5c6a112bf698eaf06b89dcb7e60eb2a2254b8f12732671c331d4a8a4858be165",
        "baseline_imported_at": "2026-06-06T10:31:15+09:00"
      }
    },
    {
      "id": "pnu-academic-geology-career-3225:1321437",
      "url": "https://geology.pusan.ac.kr/bbs/geology/156/1321437/artclView.do",
      "title": "[필독] 홈페이지 사용 관련, 사용신청",
      "_pnu": {
        "source_id": "pnu-academic-geology-career-3225",
        "published_at": "2011-10-21",
        "fetched_at": "2026-06-06T13:24:36+09:00",
        "snippet": null,
        "attachments": [],
        "content_hash": "5c6a112bf698eaf06b89dcb7e60eb2a2254b8f12732671c331d4a8a4858be165",
        "same_notice_group_id": "same_notice:149d75fe4d347ea3",
        "canonical_item_id": "pnu-academic-geology-career-3225:1321437",
        "is_canonical": true,
        "same_notice_source_ids": [
          "pnu-academic-geology-career-3225",
          "pnu-academic-geology-general-3212"
        ],
        "source_name": "부산대 지질환경과학과 취업정보",
        "content_access": {
          "detail_url": "https://geology.pusan.ac.kr/bbs/geology/156/1321437/artclView.do",
          "requires_login": false,
          "content_mirrored": false,
          "attachments_mirrored": false
        },
        "tags": [
          "pnu",
          "official",
          "academic_unit",
          "college_department",
          "department_notice",
          "career"
        ],
        "source_category": "academic_unit_career_notice",
        "source_tags": [
          "pnu",
          "official",
          "academic_unit",
          "college_department",
          "department_notice",
          "career"
        ],
        "topics": [
          "career"
        ]
      },
      "content_text": "This feed does not mirror the full notice body. Fetch the original notice URL for complete content.",
      "summary": null,
      "date_published": "2011-10-21T00:00:00+09:00",
      "_archive": {
        "archive_month": "2011-10",
        "first_seen_at": "2026-06-06T13:24:36+09:00",
        "last_seen_at": "2026-06-06T13:24:36+09:00",
        "last_changed_at": "2026-06-06T13:24:36+09:00",
        "current_content_hash": "5c6a112bf698eaf06b89dcb7e60eb2a2254b8f12732671c331d4a8a4858be165",
        "baseline_imported_at": "2026-06-06T13:24:36+09:00"
      }
    }
  ],
  "events": []
}
