{
  "schema_version": "0.1",
  "archive_version": "0.3",
  "archive_type": "month",
  "archive_month": "2013-04",
  "last_modified_at": "2026-06-06T13:24:36+09:00",
  "timezone": "Asia/Seoul",
  "item_count": 1,
  "event_count": 0,
  "source_counts": {
    "pnu-academic-dance-event-12637": 1
  },
  "items": [
    {
      "id": "pnu-academic-dance-event-12637:1126501",
      "url": "https://dance.pusan.ac.kr/bbs/dance/1349/1126501/artclView.do",
      "title": "2013년 무용학과 목요아트스페셜",
      "_pnu": {
        "source_id": "pnu-academic-dance-event-12637",
        "published_at": "2013-04-29",
        "fetched_at": "2026-06-06T13:24:36+09:00",
        "snippet": null,
        "attachments": [],
        "content_hash": "35140c898c514222fc61e1b391b254ff8c4a2c61f142f4d748865a04dab9262b",
        "same_notice_group_id": null,
        "canonical_item_id": "pnu-academic-dance-event-12637:1126501",
        "is_canonical": true,
        "same_notice_source_ids": [
          "pnu-academic-dance-event-12637"
        ],
        "source_name": "부산대 무용학과 학과행사",
        "content_access": {
          "detail_url": "https://dance.pusan.ac.kr/bbs/dance/1349/1126501/artclView.do",
          "requires_login": false,
          "content_mirrored": false,
          "attachments_mirrored": false
        },
        "tags": [
          "pnu",
          "official",
          "academic_unit",
          "college_department",
          "department_notice",
          "event"
        ],
        "source_category": "academic_unit_event_notice",
        "source_tags": [
          "pnu",
          "official",
          "academic_unit",
          "college_department",
          "department_notice",
          "event"
        ],
        "topics": [
          "event"
        ]
      },
      "content_text": "This feed does not mirror the full notice body. Fetch the original notice URL for complete content.",
      "summary": null,
      "date_published": "2013-04-29T00:00:00+09:00",
      "_archive": {
        "archive_month": "2013-04",
        "first_seen_at": "2026-06-06T13:24:36+09:00",
        "last_seen_at": "2026-06-06T13:24:36+09:00",
        "last_changed_at": "2026-06-06T13:24:36+09:00",
        "current_content_hash": "35140c898c514222fc61e1b391b254ff8c4a2c61f142f4d748865a04dab9262b",
        "baseline_imported_at": "2026-06-06T13:24:36+09:00"
      }
    }
  ],
  "events": []
}
