{
  "schema_version": "0.1",
  "archive_version": "0.4",
  "archive_type": "month",
  "archive_month": "2014-01",
  "last_modified_at": "2026-06-06T13:51:13+09:00",
  "timezone": "Asia/Seoul",
  "item_count": 1,
  "event_count": 0,
  "source_counts": {
    "pnu-academic-polsci-undergrad-7498": 1
  },
  "items": [
    {
      "id": "pnu-academic-polsci-undergrad-7498:1065382",
      "url": "https://polsci.pusan.ac.kr/bbs/polsci/887/1065382/artclView.do",
      "title": "정치외교학과 복수전공ㆍ부전공 신청자 학점 이수",
      "content_text": "This feed does not mirror the full notice body. Fetch the original notice URL for complete content.",
      "summary": null,
      "date_published": "2014-01-29T00:00:00+09:00",
      "_pnu": {
        "source_id": "pnu-academic-polsci-undergrad-7498",
        "source_name": "부산대 정치외교학과 학부 공지사항",
        "published_at": "2014-01-29",
        "fetched_at": "2026-06-06T10:31:15+09:00",
        "snippet": null,
        "content_access": {
          "detail_url": "https://polsci.pusan.ac.kr/bbs/polsci/887/1065382/artclView.do",
          "requires_login": false,
          "content_mirrored": false,
          "attachments_mirrored": false
        },
        "attachments": [],
        "tags": [
          "pnu",
          "official",
          "academic_unit",
          "college_department",
          "department_notice",
          "undergrad"
        ],
        "content_hash": "279fe84f259ac46fea762d2a4f0ce8446276d2caf684ab14b80788a771484df2",
        "source_category": "academic_unit_undergraduate_notice",
        "source_tags": [
          "pnu",
          "official",
          "academic_unit",
          "college_department",
          "department_notice",
          "undergrad"
        ],
        "topics": [
          "undergraduate"
        ],
        "same_notice_group_id": null,
        "canonical_item_id": "pnu-academic-polsci-undergrad-7498:1065382",
        "is_canonical": true,
        "same_notice_source_ids": [
          "pnu-academic-polsci-undergrad-7498"
        ]
      },
      "_archive": {
        "archive_month": "2014-01",
        "first_seen_at": "2026-06-06T10:31:15+09:00",
        "last_seen_at": "2026-06-06T10:31:15+09:00",
        "last_changed_at": "2026-06-06T10:31:15+09:00",
        "current_content_hash": "279fe84f259ac46fea762d2a4f0ce8446276d2caf684ab14b80788a771484df2",
        "baseline_imported_at": "2026-06-06T10:31:15+09:00"
      }
    }
  ],
  "events": []
}
