{
  "schema_version": "0.1",
  "archive_version": "0.4",
  "archive_type": "month",
  "archive_month": "2015-02",
  "last_modified_at": "2026-06-06T13:51:13+09:00",
  "timezone": "Asia/Seoul",
  "item_count": 1,
  "event_count": 0,
  "source_counts": {
    "pnu-academic-pnuenglish-grad-8312": 1
  },
  "items": [
    {
      "id": "pnu-academic-pnuenglish-grad-8312:996743",
      "url": "https://pnuenglish.pusan.ac.kr/bbs/pnuenglish/952/996743/artclView.do",
      "title": "학위청구 시험 신청시 주의사항 필독 !!",
      "content_text": "This feed does not mirror the full notice body. Fetch the original notice URL for complete content.",
      "summary": null,
      "date_published": "2015-02-25T00:00:00+09:00",
      "_pnu": {
        "source_id": "pnu-academic-pnuenglish-grad-8312",
        "source_name": "부산대 영어영문학과 대학원공지사항",
        "published_at": "2015-02-25",
        "fetched_at": "2026-06-06T10:31:15+09:00",
        "snippet": null,
        "content_access": {
          "detail_url": "https://pnuenglish.pusan.ac.kr/bbs/pnuenglish/952/996743/artclView.do",
          "requires_login": false,
          "content_mirrored": false,
          "attachments_mirrored": false
        },
        "attachments": [],
        "tags": [
          "pnu",
          "official",
          "academic_unit",
          "college_department",
          "department_notice",
          "grad"
        ],
        "content_hash": "b761eff38ec503a6d8ad7cd8e2c7fc9aa73e2693ca41bbd8808f57eacf27a189",
        "source_category": "academic_unit_graduate_notice",
        "source_tags": [
          "pnu",
          "official",
          "academic_unit",
          "college_department",
          "department_notice",
          "grad"
        ],
        "topics": [
          "graduate",
          "course",
          "graduation"
        ],
        "same_notice_group_id": null,
        "canonical_item_id": "pnu-academic-pnuenglish-grad-8312:996743",
        "is_canonical": true,
        "same_notice_source_ids": [
          "pnu-academic-pnuenglish-grad-8312"
        ]
      },
      "_archive": {
        "archive_month": "2015-02",
        "first_seen_at": "2026-06-06T10:31:15+09:00",
        "last_seen_at": "2026-06-06T10:31:15+09:00",
        "last_changed_at": "2026-06-06T10:31:15+09:00",
        "current_content_hash": "b761eff38ec503a6d8ad7cd8e2c7fc9aa73e2693ca41bbd8808f57eacf27a189",
        "baseline_imported_at": "2026-06-06T10:31:15+09:00"
      }
    }
  ],
  "events": []
}
