{
  "schema_version": "0.1",
  "archive_version": "0.3",
  "archive_type": "month",
  "archive_month": "2020-07",
  "last_modified_at": "2026-06-06T13:24:36+09:00",
  "timezone": "Asia/Seoul",
  "item_count": 3,
  "event_count": 0,
  "source_counts": {
    "pnu-academic-dance-general-12636": 1,
    "pnu-academic-ie-event-5851": 1,
    "pnu-graduate-gspa-grad-10906": 1
  },
  "items": [
    {
      "id": "pnu-academic-dance-general-12636:1126473",
      "url": "https://dance.pusan.ac.kr/bbs/dance/1347/1126473/artclView.do",
      "title": "2020년 부산대학교 전국 중?고등학생 무용경연대회 결과",
      "content_text": "This feed does not mirror the full notice body. Fetch the original notice URL for complete content.",
      "summary": null,
      "date_published": "2020-07-15T00:00:00+09:00",
      "_pnu": {
        "source_id": "pnu-academic-dance-general-12636",
        "source_name": "부산대 무용학과 공지사항",
        "published_at": "2020-07-15",
        "fetched_at": "2026-06-06T10:31:15+09:00",
        "snippet": null,
        "content_access": {
          "detail_url": "https://dance.pusan.ac.kr/bbs/dance/1347/1126473/artclView.do",
          "requires_login": false,
          "content_mirrored": false,
          "attachments_mirrored": false
        },
        "attachments": [],
        "tags": [
          "pnu",
          "official",
          "academic_unit",
          "college_department",
          "department_notice",
          "general"
        ],
        "content_hash": "d197133ad3badf625d6c1afaa4cb28f27fcae8e36b1c92e1227cd2ec331106f1",
        "source_category": "academic_unit_notice",
        "source_tags": [
          "pnu",
          "official",
          "academic_unit",
          "college_department",
          "department_notice",
          "general"
        ],
        "topics": [
          "contest"
        ],
        "same_notice_group_id": null,
        "canonical_item_id": "pnu-academic-dance-general-12636:1126473",
        "is_canonical": true,
        "same_notice_source_ids": [
          "pnu-academic-dance-general-12636"
        ]
      },
      "_archive": {
        "archive_month": "2020-07",
        "first_seen_at": "2026-06-06T10:31:15+09:00",
        "last_seen_at": "2026-06-06T10:31:15+09:00",
        "last_changed_at": "2026-06-06T10:31:15+09:00",
        "current_content_hash": "d197133ad3badf625d6c1afaa4cb28f27fcae8e36b1c92e1227cd2ec331106f1",
        "baseline_imported_at": "2026-06-06T10:31:15+09:00"
      }
    },
    {
      "id": "pnu-academic-ie-event-5851:1182593",
      "url": "https://ie.pusan.ac.kr/bbs/ie/659/1182593/artclView.do",
      "title": "2019년 2학기 산업공학과 세미나 개최 현황",
      "_pnu": {
        "source_id": "pnu-academic-ie-event-5851",
        "published_at": "2020-07-13",
        "fetched_at": "2026-06-06T13:24:36+09:00",
        "snippet": null,
        "attachments": [],
        "content_hash": "51fdc7d2f9e155d69517a1329e37202d1343af4610229c4b96c9c25d833ffc78",
        "same_notice_group_id": null,
        "canonical_item_id": "pnu-academic-ie-event-5851:1182593",
        "is_canonical": true,
        "same_notice_source_ids": [
          "pnu-academic-ie-event-5851"
        ],
        "source_name": "부산대 산업공학과 학과세미나",
        "content_access": {
          "detail_url": "https://ie.pusan.ac.kr/bbs/ie/659/1182593/artclView.do",
          "requires_login": false,
          "content_mirrored": false,
          "attachments_mirrored": false
        },
        "tags": [
          "pnu",
          "official",
          "academic_unit",
          "college_department",
          "department_notice",
          "event"
        ],
        "source_category": "academic_unit_event_notice",
        "source_tags": [
          "pnu",
          "official",
          "academic_unit",
          "college_department",
          "department_notice",
          "event"
        ],
        "topics": [
          "event"
        ]
      },
      "content_text": "This feed does not mirror the full notice body. Fetch the original notice URL for complete content.",
      "summary": null,
      "date_published": "2020-07-13T00:00:00+09:00",
      "_archive": {
        "archive_month": "2020-07",
        "first_seen_at": "2026-06-06T13:24:36+09:00",
        "last_seen_at": "2026-06-06T13:24:36+09:00",
        "last_changed_at": "2026-06-06T13:24:36+09:00",
        "current_content_hash": "51fdc7d2f9e155d69517a1329e37202d1343af4610229c4b96c9c25d833ffc78",
        "baseline_imported_at": "2026-06-06T13:24:36+09:00"
      }
    },
    {
      "id": "pnu-graduate-gspa-grad-10906:1029547",
      "url": "https://gspa.pusan.ac.kr/bbs/gspa/481/1029547/artclView.do",
      "title": "2020.1학기 최고관리자과정 장학금 내역",
      "_pnu": {
        "source_id": "pnu-graduate-gspa-grad-10906",
        "published_at": "2020-07-06",
        "fetched_at": "2026-06-06T13:24:36+09:00",
        "snippet": null,
        "attachments": [],
        "content_hash": "9d94b02947a6679a46355ce40ad604d029dd7e3a6619f1e0757ef5d5560472e3",
        "same_notice_group_id": null,
        "canonical_item_id": "pnu-graduate-gspa-grad-10906:1029547",
        "is_canonical": true,
        "same_notice_source_ids": [
          "pnu-graduate-gspa-grad-10906"
        ],
        "source_name": "부산대 행정대학원 공지사항 2",
        "content_access": {
          "detail_url": "https://gspa.pusan.ac.kr/bbs/gspa/481/1029547/artclView.do",
          "requires_login": false,
          "content_mirrored": false,
          "attachments_mirrored": false
        },
        "tags": [
          "pnu",
          "official",
          "graduate_school",
          "graduate"
        ],
        "source_category": "graduate_school_notice",
        "source_tags": [
          "pnu",
          "official",
          "graduate_school",
          "graduate"
        ],
        "topics": [
          "graduate",
          "scholarship"
        ]
      },
      "content_text": "This feed does not mirror the full notice body. Fetch the original notice URL for complete content.",
      "summary": null,
      "date_published": "2020-07-06T00:00:00+09:00",
      "_archive": {
        "archive_month": "2020-07",
        "first_seen_at": "2026-06-06T13:24:36+09:00",
        "last_seen_at": "2026-06-06T13:24:36+09:00",
        "last_changed_at": "2026-06-06T13:24:36+09:00",
        "current_content_hash": "9d94b02947a6679a46355ce40ad604d029dd7e3a6619f1e0757ef5d5560472e3",
        "baseline_imported_at": "2026-06-06T13:24:36+09:00"
      }
    }
  ],
  "events": []
}
