{
  "schema_version": "0.1",
  "archive_version": "0.4",
  "archive_type": "month",
  "archive_month": "2017-09",
  "last_modified_at": "2026-06-06T13:51:13+09:00",
  "timezone": "Asia/Seoul",
  "item_count": 4,
  "event_count": 0,
  "source_counts": {
    "pnu-academic-pnuenglish-grad-8312": 1,
    "pnu-academic-cse-career-14234": 1,
    "pnu-academic-plant-career-8295": 1,
    "pnu-academic-psy-general-2370": 1
  },
  "items": [
    {
      "id": "pnu-academic-pnuenglish-grad-8312:996906",
      "url": "https://pnuenglish.pusan.ac.kr/bbs/pnuenglish/952/996906/artclView.do",
      "title": "학위청구논문 서식 수정사항",
      "content_text": "This feed does not mirror the full notice body. Fetch the original notice URL for complete content.",
      "summary": null,
      "date_published": "2017-09-28T00:00:00+09:00",
      "_pnu": {
        "source_id": "pnu-academic-pnuenglish-grad-8312",
        "source_name": "부산대 영어영문학과 대학원공지사항",
        "published_at": "2017-09-28",
        "fetched_at": "2026-06-06T10:31:15+09:00",
        "snippet": null,
        "content_access": {
          "detail_url": "https://pnuenglish.pusan.ac.kr/bbs/pnuenglish/952/996906/artclView.do",
          "requires_login": false,
          "content_mirrored": false,
          "attachments_mirrored": false
        },
        "attachments": [],
        "tags": [
          "pnu",
          "official",
          "academic_unit",
          "college_department",
          "department_notice",
          "grad"
        ],
        "content_hash": "e173705089d8aafacb3743384b429e237b0cc8ee546f3fca9c8ee840979e857d",
        "source_category": "academic_unit_graduate_notice",
        "source_tags": [
          "pnu",
          "official",
          "academic_unit",
          "college_department",
          "department_notice",
          "grad"
        ],
        "topics": [
          "graduate",
          "graduation"
        ],
        "same_notice_group_id": null,
        "canonical_item_id": "pnu-academic-pnuenglish-grad-8312:996906",
        "is_canonical": true,
        "same_notice_source_ids": [
          "pnu-academic-pnuenglish-grad-8312"
        ]
      },
      "_archive": {
        "archive_month": "2017-09",
        "first_seen_at": "2026-06-06T10:31:15+09:00",
        "last_seen_at": "2026-06-06T10:31:15+09:00",
        "last_changed_at": "2026-06-06T10:31:15+09:00",
        "current_content_hash": "e173705089d8aafacb3743384b429e237b0cc8ee546f3fca9c8ee840979e857d",
        "baseline_imported_at": "2026-06-06T10:31:15+09:00"
      }
    },
    {
      "id": "pnu-academic-cse-career-14234:1395325",
      "url": "https://cse.pusan.ac.kr/bbs/cse/2060/1395325/artclView.do",
      "title": "채용게시판 이용 안내 및 채용/아르바이트 공지를 위한 계정 안내",
      "_pnu": {
        "source_id": "pnu-academic-cse-career-14234",
        "published_at": "2017-09-19",
        "fetched_at": "2026-06-06T13:24:36+09:00",
        "snippet": null,
        "attachments": [],
        "content_hash": "fadaddddc45356d3aba88ab59886c333a918d7a8c11a8c97a33fda7f5ecb82db",
        "same_notice_group_id": null,
        "canonical_item_id": "pnu-academic-cse-career-14234:1395325",
        "is_canonical": true,
        "same_notice_source_ids": [
          "pnu-academic-cse-career-14234"
        ],
        "source_name": "부산대 정보컴퓨터공학부 채용게시판",
        "content_access": {
          "detail_url": "https://cse.pusan.ac.kr/bbs/cse/2060/1395325/artclView.do",
          "requires_login": false,
          "content_mirrored": false,
          "attachments_mirrored": false
        },
        "tags": [
          "pnu",
          "official",
          "academic_unit",
          "college_department",
          "department_notice",
          "career"
        ],
        "source_category": "academic_unit_career_notice",
        "source_tags": [
          "pnu",
          "official",
          "academic_unit",
          "college_department",
          "department_notice",
          "career"
        ],
        "topics": [
          "career",
          "recruitment"
        ]
      },
      "content_text": "This feed does not mirror the full notice body. Fetch the original notice URL for complete content.",
      "summary": null,
      "date_published": "2017-09-19T00:00:00+09:00",
      "_archive": {
        "archive_month": "2017-09",
        "first_seen_at": "2026-06-06T13:24:36+09:00",
        "last_seen_at": "2026-06-06T13:24:36+09:00",
        "last_changed_at": "2026-06-06T13:24:36+09:00",
        "current_content_hash": "fadaddddc45356d3aba88ab59886c333a918d7a8c11a8c97a33fda7f5ecb82db",
        "baseline_imported_at": "2026-06-06T13:24:36+09:00"
      }
    },
    {
      "id": "pnu-academic-plant-career-8295:1098002",
      "url": "https://plant.pusan.ac.kr/bbs/plant/947/1098002/artclView.do",
      "title": "식물생명과학과 취업현황(2022.03월 기준)",
      "_pnu": {
        "source_id": "pnu-academic-plant-career-8295",
        "published_at": "2017-09-13",
        "fetched_at": "2026-06-06T13:24:36+09:00",
        "snippet": null,
        "attachments": [],
        "content_hash": "0d15f612c4dd9934b8df76950c36d4c65298013ca29d80d8a0c131704037e713",
        "same_notice_group_id": null,
        "canonical_item_id": "pnu-academic-plant-career-8295:1098002",
        "is_canonical": true,
        "same_notice_source_ids": [
          "pnu-academic-plant-career-8295"
        ],
        "source_name": "부산대 식물생명과학과 취업정보",
        "content_access": {
          "detail_url": "https://plant.pusan.ac.kr/bbs/plant/947/1098002/artclView.do",
          "requires_login": false,
          "content_mirrored": false,
          "attachments_mirrored": false
        },
        "tags": [
          "pnu",
          "official",
          "academic_unit",
          "college_department",
          "department_notice",
          "career"
        ],
        "source_category": "academic_unit_career_notice",
        "source_tags": [
          "pnu",
          "official",
          "academic_unit",
          "college_department",
          "department_notice",
          "career"
        ],
        "topics": [
          "career"
        ]
      },
      "content_text": "This feed does not mirror the full notice body. Fetch the original notice URL for complete content.",
      "summary": null,
      "date_published": "2017-09-13T00:00:00+09:00",
      "_archive": {
        "archive_month": "2017-09",
        "first_seen_at": "2026-06-06T13:24:36+09:00",
        "last_seen_at": "2026-06-06T13:24:36+09:00",
        "last_changed_at": "2026-06-06T13:24:36+09:00",
        "current_content_hash": "0d15f612c4dd9934b8df76950c36d4c65298013ca29d80d8a0c131704037e713",
        "baseline_imported_at": "2026-06-06T13:24:36+09:00"
      }
    },
    {
      "id": "pnu-academic-psy-general-2370:1068702",
      "url": "https://psy.pusan.ac.kr/bbs/psy/348/1068702/artclView.do",
      "title": "[2017학년도 2학기 과목 추가 방법] 1학기에도 소나시스템을 사용했던 학생들 대상",
      "content_text": "This feed does not mirror the full notice body. Fetch the original notice URL for complete content.",
      "summary": null,
      "date_published": "2017-09-08T00:00:00+09:00",
      "_pnu": {
        "source_id": "pnu-academic-psy-general-2370",
        "source_name": "부산대 심리학과 공지&자료게시판",
        "published_at": "2017-09-08",
        "fetched_at": "2026-06-06T10:31:15+09:00",
        "snippet": null,
        "content_access": {
          "detail_url": "https://psy.pusan.ac.kr/bbs/psy/348/1068702/artclView.do",
          "requires_login": false,
          "content_mirrored": false,
          "attachments_mirrored": false
        },
        "attachments": [],
        "tags": [
          "pnu",
          "official",
          "academic_unit",
          "college_department",
          "department_notice",
          "general"
        ],
        "content_hash": "a92d248d0947d18b2ec5acd22c8a7cb7b4c0cd824ea3ba79d07cedfdba0643aa",
        "source_category": "academic_unit_notice",
        "source_tags": [
          "pnu",
          "official",
          "academic_unit",
          "college_department",
          "department_notice",
          "general"
        ],
        "topics": [
          "campus_service"
        ],
        "same_notice_group_id": null,
        "canonical_item_id": "pnu-academic-psy-general-2370:1068702",
        "is_canonical": true,
        "same_notice_source_ids": [
          "pnu-academic-psy-general-2370"
        ]
      },
      "_archive": {
        "archive_month": "2017-09",
        "first_seen_at": "2026-06-06T10:31:15+09:00",
        "last_seen_at": "2026-06-06T10:31:15+09:00",
        "last_changed_at": "2026-06-06T10:31:15+09:00",
        "current_content_hash": "a92d248d0947d18b2ec5acd22c8a7cb7b4c0cd824ea3ba79d07cedfdba0643aa",
        "baseline_imported_at": "2026-06-06T10:31:15+09:00"
      }
    }
  ],
  "events": []
}
