{
  "schema_version": "0.1",
  "archive_version": "0.3",
  "archive_type": "month",
  "archive_month": "2018-06",
  "last_modified_at": "2026-06-06T13:24:36+09:00",
  "timezone": "Asia/Seoul",
  "item_count": 3,
  "event_count": 0,
  "source_counts": {
    "pnu-academic-geology-general-3212": 1,
    "pnu-academic-molbiology-event-6782": 1,
    "pnu-academic-fst-career-10300": 1
  },
  "items": [
    {
      "id": "pnu-academic-geology-general-3212:1322063",
      "url": "https://geology.pusan.ac.kr/bbs/geology/156/1322063/artclView.do",
      "title": "지질환경과학과 전과(전출사항) 지침[개정]18.6",
      "content_text": "This feed does not mirror the full notice body. Fetch the original notice URL for complete content.",
      "summary": null,
      "date_published": "2018-06-29T00:00:00+09:00",
      "_pnu": {
        "source_id": "pnu-academic-geology-general-3212",
        "source_name": "부산대 지질환경과학과 공지사항",
        "published_at": "2018-06-29",
        "fetched_at": "2026-06-06T10:31:15+09:00",
        "snippet": null,
        "content_access": {
          "detail_url": "https://geology.pusan.ac.kr/bbs/geology/156/1322063/artclView.do",
          "requires_login": false,
          "content_mirrored": false,
          "attachments_mirrored": false
        },
        "attachments": [],
        "tags": [
          "pnu",
          "official",
          "academic_unit",
          "college_department",
          "department_notice",
          "general"
        ],
        "content_hash": "29c138eb9a0bc822184ad9b8b9c275a1f21fa2b379cdfb35dd388a377087e126",
        "source_category": "academic_unit_notice",
        "source_tags": [
          "pnu",
          "official",
          "academic_unit",
          "college_department",
          "department_notice",
          "general"
        ],
        "topics": [
          "academic_records"
        ],
        "same_notice_group_id": null,
        "canonical_item_id": "pnu-academic-geology-general-3212:1322063",
        "is_canonical": true,
        "same_notice_source_ids": [
          "pnu-academic-geology-general-3212"
        ]
      },
      "_archive": {
        "archive_month": "2018-06",
        "first_seen_at": "2026-06-06T10:31:15+09:00",
        "last_seen_at": "2026-06-06T10:31:15+09:00",
        "last_changed_at": "2026-06-06T10:31:15+09:00",
        "current_content_hash": "29c138eb9a0bc822184ad9b8b9c275a1f21fa2b379cdfb35dd388a377087e126",
        "baseline_imported_at": "2026-06-06T10:31:15+09:00"
      }
    },
    {
      "id": "pnu-academic-molbiology-event-6782:1242627",
      "url": "https://molbiology.pusan.ac.kr/bbs/molbiology/796/1242627/artclView.do",
      "title": "초청세미나 안내(2018.6.7)",
      "_pnu": {
        "source_id": "pnu-academic-molbiology-event-6782",
        "published_at": "2018-06-07",
        "fetched_at": "2026-06-06T13:24:36+09:00",
        "snippet": null,
        "attachments": [],
        "content_hash": "f20540c36b59e13dd35d38125fd364eb8ff80a835adcd20b4a84ed9fd1e588e3",
        "same_notice_group_id": null,
        "canonical_item_id": "pnu-academic-molbiology-event-6782:1242627",
        "is_canonical": true,
        "same_notice_source_ids": [
          "pnu-academic-molbiology-event-6782"
        ],
        "source_name": "부산대 분자생물학과 세미나 안내",
        "content_access": {
          "detail_url": "https://molbiology.pusan.ac.kr/bbs/molbiology/796/1242627/artclView.do",
          "requires_login": false,
          "content_mirrored": false,
          "attachments_mirrored": false
        },
        "tags": [
          "pnu",
          "official",
          "academic_unit",
          "college_department",
          "department_notice",
          "event"
        ],
        "source_category": "academic_unit_event_notice",
        "source_tags": [
          "pnu",
          "official",
          "academic_unit",
          "college_department",
          "department_notice",
          "event"
        ],
        "topics": [
          "event"
        ]
      },
      "content_text": "This feed does not mirror the full notice body. Fetch the original notice URL for complete content.",
      "summary": null,
      "date_published": "2018-06-07T00:00:00+09:00",
      "_archive": {
        "archive_month": "2018-06",
        "first_seen_at": "2026-06-06T13:24:36+09:00",
        "last_seen_at": "2026-06-06T13:24:36+09:00",
        "last_changed_at": "2026-06-06T13:24:36+09:00",
        "current_content_hash": "f20540c36b59e13dd35d38125fd364eb8ff80a835adcd20b4a84ed9fd1e588e3",
        "baseline_imported_at": "2026-06-06T13:24:36+09:00"
      }
    },
    {
      "id": "pnu-academic-fst-career-10300:1345215",
      "url": "https://fst.pusan.ac.kr/bbs/fst/828/1345215/artclView.do",
      "title": "2018년도 제23회 경상남도 지방공무원 임용시험 시행계획공고",
      "_pnu": {
        "source_id": "pnu-academic-fst-career-10300",
        "published_at": "2018-06-04",
        "fetched_at": "2026-06-06T13:24:36+09:00",
        "snippet": null,
        "attachments": [],
        "content_hash": "b431d0390508e435bfd0b1e86faf958cd5acb712f5ff5c3ca67056375cfe284b",
        "same_notice_group_id": null,
        "canonical_item_id": "pnu-academic-fst-career-10300:1345215",
        "is_canonical": true,
        "same_notice_source_ids": [
          "pnu-academic-fst-career-10300"
        ],
        "source_name": "부산대 식품공학과 취업게시판",
        "content_access": {
          "detail_url": "https://fst.pusan.ac.kr/bbs/fst/828/1345215/artclView.do",
          "requires_login": false,
          "content_mirrored": false,
          "attachments_mirrored": false
        },
        "tags": [
          "pnu",
          "official",
          "academic_unit",
          "college_department",
          "department_notice",
          "career"
        ],
        "source_category": "academic_unit_career_notice",
        "source_tags": [
          "pnu",
          "official",
          "academic_unit",
          "college_department",
          "department_notice",
          "career"
        ],
        "topics": [
          "career",
          "course"
        ]
      },
      "content_text": "This feed does not mirror the full notice body. Fetch the original notice URL for complete content.",
      "summary": null,
      "date_published": "2018-06-04T00:00:00+09:00",
      "_archive": {
        "archive_month": "2018-06",
        "first_seen_at": "2026-06-06T13:24:36+09:00",
        "last_seen_at": "2026-06-06T13:24:36+09:00",
        "last_changed_at": "2026-06-06T13:24:36+09:00",
        "current_content_hash": "b431d0390508e435bfd0b1e86faf958cd5acb712f5ff5c3ca67056375cfe284b",
        "baseline_imported_at": "2026-06-06T13:24:36+09:00"
      }
    }
  ],
  "events": []
}
